waveOrder	authorKo	authorHanja	timelineEra	birthDeath	authorTier	primaryCollectionTitle	sourceTrack	currentStage	currentStatus	initialTargetWorks	directTextCollectedWorks	currentMatchedSeedTitles	unresolvedSeedTitles	latestDirectTextBatchIds	latestDirectTextSources	directTextFirstSources	collectionMetadataSources	ocrFallbackSources	recommendedStartPoint	ocrEscalationTrigger	batchSuccessMetric	nextActionFromBoard	blockers	notes
1	최치원	崔致遠	고조선~통일신라	857~미상(908년 이후 생존)	core-canon	《계원필경집》	local-seed-first	rights-review	researching	20	32	秋夜雨中, 題伽倻山, 登潤州慈和寺, 江南女, 鄕樂雜詠		korean-hansi-choe-chiwon-tranche1	孤雲集 卷一	Wikisource 개별 작품/문집 페이지, 東文選/三國史記 공개 원문 페이지, 공개 고전 원문 페이지 raw 캐시	KORCIS, EncyKorea, 계원필경 계열 판본 메타데이터	규장각 원문 이미지, 디지털장서각, AI Hub 603 OCR bootstrap	현재 direct-text 시드가 가장 많으므로 공개 원문 페이지를 먼저 넓게 긁고, 남는 결손만 collection locator와 OCR로 넘긴다	공개 원문/문집 페이지에서 10건 이상 연속으로 추가 확보가 막히면 OCR lane으로 전환	최소 20건 확보 또는 계원필경 계열 1개 판본의 유효 작품 묶음 수집 완료	계원필경 계열 판본 중 표준 기준본을 하나 정하고, 5수의 실제 수록 위치를 권/책 기준으로 고정한 뒤 source policy와 rights review를 붙인다		EncyKorea와 KORCIS로 1차 확인 완료
2	정지상	鄭知常	고려	미상~1135	core-canon	《동문선》·《동경잡기》 계열	local-seed-first	rights-review	researching	15	15	送人, 新雪, 鄕宴致語, 栢律寺	西樓	korean-hansi-jeong-jisang-tranche1, korean-hansi-jeong-jisang-tranche2	東文選 卷九, 東文選 卷十二, 東文選 卷十九, 東文選 卷一百四, 新增東國輿地勝覽 卷021	Wikisource 개별 작품 페이지, 東文選 공개 원문 페이지, 동경잡기 계열 공개 페이지	KORCIS, EncyKorea, 《동문선》·《동경잡기》 계열 메타데이터	동경잡기/정사간집 이미지·PDF, 규장각 원문 이미지, AI Hub 603 OCR bootstrap	송인·신설처럼 바로 열린 공개 원문부터 넓히고, 이후 동문선/동경잡기 수록 위치를 따라 collection-first로 붙인다	동문선/동경잡기 기준으로 exact-title 후보 5건 중 3건 이상이 direct-text에서 계속 막히면 OCR lane 병행	최소 15건 확보 또는 동문선/동경잡기 한 축에서 연속 수집 가능한 작품 묶음 확보	남은 `西樓` direct-text locator를 우선 확정하고, 이미 확보한 `送人`·`新雪`·`鄕宴致語`·`栢律寺` 4건에 대해 source policy와 rights review를 author batch 단위로 마무리한다. 정사간집 direct bib는 별도 탐색으로 남긴다	정사간집 direct KORCIS bib unresolved, 西樓 poem-level locator not fixed	EncyKorea와 KORCIS collection title 검색으로 동문선/동경잡기 계열까지는 확인 완료. 현재 direct-text locator는 `送人`, `新雪`, `鄕宴致語(東文選 卷一百四)`, `栢律寺(新增東國輿地勝覽 卷021, 표기 柏栗寺)`까지 확보했다.
3	이규보	李奎報	고려	1168~1241	core-canon	《동국이상국집》	collection-first	author-verification	queued	30	0					ITKC 원문 페이지, 공개 문집 TOC/원문 페이지, Wikisource 수록 시 공개 페이지	KORCIS, EncyKorea, 《동국이상국집》 메타데이터	《동국이상국집》 원문 이미지, 디지털장서각, AI Hub 603 OCR bootstrap	대표 문집 단위로 바로 collection-first 수집에 들어가고, exact-title 정합성은 후순위로 둔다	문집 TOC는 확인되는데 텍스트 추출이 안 되는 상태가 15건 이상 누적되면 OCR lane 추가	최소 30건 확보 또는 《동국이상국집》 한 권차 슬라이스를 안정적으로 수집	대표 문집명을 기준으로 KORCIS 검색 -> 문집 판본/소장처 확인 -> EncyKorea에서 작가/작품 메타데이터 보강		《동국이상국집》
4	이색	李穡	고려	1328~1396	core-canon	《목은집》/《목은시고》	collection-first	author-verification	queued	25	0					목은집/목은시고 공개 원문 페이지, ITKC 원문 페이지, Wikisource 수록 공개 페이지	KORCIS, EncyKorea, 《목은집》·《목은시고》 메타데이터	목은집 계열 이미지·PDF, 규장각, AI Hub 603 OCR bootstrap	collection-first로 문집 한 축을 잡고, 공개 텍스트가 열리는 권차부터 연속 수집한다	권차 단위로 메타데이터는 확인되지만 텍스트 추출 가능한 작품이 5건 미만이면 OCR 병행	최소 25건 확보 또는 목은집 계열 한 슬라이스 연속 수집	대표 문집명을 기준으로 KORCIS 검색 -> 문집 판본/소장처 확인 -> EncyKorea에서 작가/작품 메타데이터 보강		《목은집》/《목은시고》
5	이제현	李齊賢	고려	1287~1367	core-canon	《익재난고》	collection-first	author-verification	queued	20	0					익재난고 공개 원문 페이지, ITKC 원문 페이지, Wikisource 수록 공개 페이지	KORCIS, EncyKorea, 《익재난고》 메타데이터	익재난고 이미지·PDF, 디지털장서각, AI Hub 603 OCR bootstrap	익재난고 계열을 collection-first로 열고, 소악부 포함 공개 텍스트 가용 작품을 묶음 수집한다	공개 텍스트 연속 확보량이 10건 아래로 막히면 OCR lane 추가	최소 20건 확보 또는 익재난고 한 묶음 안정 수집	대표 문집명을 기준으로 KORCIS 검색 -> 문집 판본/소장처 확인 -> EncyKorea에서 작가/작품 메타데이터 보강		《익재난고》
6	정도전	鄭道傳	조선전기	1342~1398	core-canon	《삼봉집》	collection-first	author-verification	queued	20	0					삼봉집 공개 원문 페이지, ITKC 원문 페이지, Wikisource 수록 공개 페이지	KORCIS, EncyKorea, 《삼봉집》 메타데이터	삼봉집 이미지·PDF, 규장각, AI Hub 603 OCR bootstrap	삼봉집 계열 collection-first로 들어가고, 정치 산문과 섞이더라도 한시 파트는 대량 확보를 우선한다	문집은 열리는데 한시 텍스트 분리 실패가 반복되면 OCR 또는 후처리 파서 lane 추가	최소 20건 확보 또는 삼봉집에서 한시 묶음 분리 성공	대표 문집명을 기준으로 KORCIS 검색 -> 문집 판본/소장처 확인 -> EncyKorea에서 작가/작품 메타데이터 보강		《삼봉집》
7	김종직	金宗直	조선전기	1431~1492	core-canon	《점필재집》	collection-first	author-verification	queued	20	0					점필재집 공개 원문 페이지, ITKC 원문 페이지, Wikisource 수록 공개 페이지	KORCIS, EncyKorea, 《점필재집》 메타데이터	점필재집 이미지·PDF, 디지털장서각, AI Hub 603 OCR bootstrap	사림파 대표 문집 축으로 보고 collection-first 대량 수집을 시도한다	문집 메타데이터는 충분한데 직접 텍스트 확보량이 10건 미만으로 막히면 OCR lane 추가	최소 20건 확보 또는 점필재집에서 한시 축 1차 슬라이스 완료	대표 문집명을 기준으로 KORCIS 검색 -> 문집 판본/소장처 확인 -> EncyKorea에서 작가/작품 메타데이터 보강		《점필재집》
8	허난설헌	許蘭雪軒	조선후기	1563~1589	core-canon	《난설헌집》	collection-first	rights-review	researching	20	0	送荷谷謫甲山, 哭子, 遣興, 貧女吟	寄夫讀書江舍			蘭雪軒詩集 공개 원문 페이지, 조선여류한시선집, Wikisource 개별/문집 페이지	KORCIS, EncyKorea, 《난설헌집》 메타데이터	난설헌집 이미지·PDF, 규장각, AI Hub 603 OCR bootstrap	현재 공개 원문 접근성이 가장 좋아서 direct-text-first로 양을 먼저 확보하고, 남는 결손만 OCR로 넘긴다	기부독서강사처럼 exact-title 누락이 남더라도 전체 수집량이 20건 미만이면 OCR lane 병행	최소 20건 확보 또는 난설헌시집 공개 원문 파트 1차 수집 완료	난설헌집 계열 중 국립중앙도서관 원문/목차 제공본을 우선 기준본으로 잡고, 5수의 수록 위치를 판본별로 고정한 뒤 source policy와 rights review를 붙인다		EncyKorea와 KORCIS로 1차 확인 완료
